"No.","Time","Source","Destination","Protocol","Length","Info"
"238","41.489788100","10.85.52.177","10.85.52.122","TCP","62","60304  >  3000 [SYN] Seq=0 Win=2144 Len=0 MSS=536 SACK_PERM"
"239","41.490086300","10.85.52.122","10.85.52.177","TCP","62","3000  >  60304 [SYN, ACK] Seq=0 Ack=1 Win=65392 Len=0 MSS=1460 SACK_PERM"
"240","41.500374600","10.85.52.177","10.85.52.122","TCP","54","60304  >  3000 [ACK] Seq=1 Ack=1 Win=2144 Len=0"
"241","41.504086200","10.85.52.177","10.85.52.122","TCP","272","60304  >  3000 [PSH, ACK] Seq=1 Ack=1 Win=2144 Len=218 [TCP PDU reassembled in 248]"
"242","41.506977500","10.85.52.177","10.85.52.122","TCP","590","60304  >  3000 [ACK] Seq=219 Ack=1 Win=2144 Len=536 [TCP PDU reassembled in 248]"
"243","41.507231100","10.85.52.122","10.85.52.177","TCP","54","3000  >  60304 [ACK] Seq=1 Ack=755 Win=65392 Len=0"
"244","41.509065300","10.85.52.177","10.85.52.122","TCP","372","60304  >  3000 [PSH, ACK] Seq=755 Ack=1 Win=2144 Len=318 [TCP PDU reassembled in 248]"
"245","41.523373600","10.85.52.177","10.85.52.122","TCP","590","60304  >  3000 [ACK] Seq=1073 Ack=1 Win=2144 Len=536 [TCP PDU reassembled in 248]"
"246","41.523373600","10.85.52.177","10.85.52.122","TCP","272","60304  >  3000 [PSH, ACK] Seq=1609 Ack=1 Win=2144 Len=218 [TCP PDU reassembled in 248]"
"247","41.523680600","10.85.52.122","10.85.52.177","TCP","54","3000  >  60304 [ACK] Seq=1 Ack=1609 Win=65392 Len=0"
"248","41.532199600","10.85.52.177","10.85.52.122","HTTP/JSON","521","POST /api/data/large HTTP/1.1 , JSON (application/json)"
"249","41.532445900","10.85.52.122","10.85.52.177","TCP","54","3000  >  60304 [ACK] Seq=1 Ack=2294 Win=65392 Len=0"
"250","41.533305200","10.85.52.122","10.85.52.177","HTTP","282","HTTP/1.1 200 OK  (text/html)"
"251","41.545982400","10.85.52.177","10.85.52.122","TCP","240","60304  >  3000 [PSH, ACK] Seq=2294 Ack=229 Win=1916 Len=186 [TCP PDU reassembled in 260]"
"252","41.545982400","10.85.52.177","10.85.52.122","TCP","590","60304  >  3000 [ACK] Seq=2480 Ack=229 Win=1916 Len=536 [TCP PDU reassembled in 260]"
"253","41.546317900","10.85.52.122","10.85.52.177","TCP","54","3000  >  60304 [ACK] Seq=229 Ack=3016 Win=65392 Len=0"
"254","41.547351000","10.85.52.122","10.85.52.177","HTTP","282","HTTP/1.1 200 OK  (text/html)"
"255","41.549207200","10.85.52.177","10.85.52.122","TCP","404","60304  >  3000 [PSH, ACK] Seq=3016 Ack=229 Win=1916 Len=350 [TCP PDU reassembled in 260]"
"256","41.556858200","10.85.52.177","10.85.52.122","TCP","590","60304  >  3000 [ACK] Seq=3366 Ack=457 Win=1688 Len=536 [TCP PDU reassembled in 260]"
"257","41.557105900","10.85.52.122","10.85.52.177","TCP","54","3000  >  60304 [ACK] Seq=457 Ack=3902 Win=65392 Len=0"
"258","41.559815700","10.85.52.177","10.85.52.122","TCP","240","60304  >  3000 [PSH, ACK] Seq=3902 Ack=457 Win=1688 Len=186 [TCP PDU reassembled in 260]"
"260","41.574007600","10.85.52.177","10.85.52.122","HTTP","521","POST /api/data/large HTTP/1.1 "
"261","41.574225800","10.85.52.122","10.85.52.177","TCP","54","3000  >  60304 [ACK] Seq=457 Ack=4555 Win=65392 Len=0"
"262","41.576989100","10.85.52.177","10.85.52.122","TCP","240","60304  >  3000 [PSH, ACK] Seq=4555 Ack=457 Win=1688 Len=186 [TCP PDU reassembled in 274]"
"263","41.576989100","10.85.52.177","10.85.52.122","TCP","287","60304  >  3000 [PSH, ACK] Seq=4741 Ack=457 Win=1688 Len=233 [TCP PDU reassembled in 274]"
"264","41.577242700","10.85.52.122","10.85.52.177","TCP","54","3000  >  60304 [ACK] Seq=457 Ack=4974 Win=64973 Len=0"
"265","41.577822500","10.85.52.122","10.85.52.177","HTTP","282","HTTP/1.1 200 OK  (text/html)"
"266","41.588459600","10.85.52.177","10.85.52.122","TCP","590","60304  >  3000 [ACK] Seq=4974 Ack=457 Win=1688 Len=536 [TCP PDU reassembled in 274]"
"267","41.588459600","10.85.52.177","10.85.52.122","TCP","171","60304  >  3000 [PSH, ACK] Seq=5510 Ack=457 Win=1688 Len=117 [TCP PDU reassembled in 274]"
"268","41.588661700","10.85.52.122","10.85.52.177","TCP","54","3000  >  60304 [ACK] Seq=685 Ack=5510 Win=65392 Len=0"
"269","41.588891300","10.85.52.122","10.85.52.177","TCP","54","3000  >  60304 [ACK] Seq=685 Ack=5627 Win=65275 Len=0"
"270","41.591643400","10.85.52.177","10.85.52.122","TCP","473","60304  >  3000 [PSH, ACK] Seq=5627 Ack=685 Win=1460 Len=419 [TCP PDU reassembled in 274]"
"271","41.598439400","10.85.52.177","10.85.52.122","TCP","590","60304  >  3000 [PSH, ACK] Seq=6046 Ack=685 Win=1460 Len=536 [TCP PDU reassembled in 274]"
"272","41.598439400","10.85.52.177","10.85.52.122","TCP","171","60304  >  3000 [PSH, ACK] Seq=6582 Ack=685 Win=1460 Len=117 [TCP PDU reassembled in 274]"
"273","41.598787200","10.85.52.122","10.85.52.177","TCP","54","3000  >  60304 [ACK] Seq=685 Ack=6582 Win=65392 Len=0"
"274","41.612366700","10.85.52.177","10.85.52.122","HTTP","171","POST /api/data/large HTTP/1.1 "
"275","41.612366700","10.85.52.177","10.85.52.122","TCP","54","[TCP Window Update] 60304  >  3000 [ACK] Seq=6816 Ack=685 Win=1996 Len=0"
"276","41.612634200","10.85.52.122","10.85.52.177","TCP","54","3000  >  60304 [ACK] Seq=685 Ack=6816 Win=65158 Len=0"
"277","41.614250300","10.85.52.177","10.85.52.122","TCP","240","60304  >  3000 [PSH, ACK] Seq=6816 Ack=685 Win=1996 Len=186 [TCP PDU reassembled in 287]"
"278","41.615140400","10.85.52.122","10.85.52.177","HTTP","282","HTTP/1.1 200 OK  (text/html)"
"279","41.625594700","10.85.52.177","10.85.52.122","TCP","590","60304  >  3000 [ACK] Seq=7002 Ack=685 Win=1996 Len=536 [TCP PDU reassembled in 287]"
"280","41.625594700","10.85.52.177","10.85.52.122","TCP","170","60304  >  3000 [PSH, ACK] Seq=7538 Ack=685 Win=1996 Len=116 [TCP PDU reassembled in 287]"
"281","41.625853800","10.85.52.122","10.85.52.177","TCP","54","3000  >  60304 [ACK] Seq=913 Ack=7538 Win=65392 Len=0"
"282","41.626034200","10.85.52.122","10.85.52.177","TCP","54","3000  >  60304 [ACK] Seq=913 Ack=7654 Win=65276 Len=0"
"283","41.634570900","10.85.52.177","10.85.52.122","TCP","474","60304  >  3000 [PSH, ACK] Seq=7654 Ack=913 Win=1768 Len=420 [TCP PDU reassembled in 287]"
"284","41.636437300","10.85.52.177","10.85.52.122","TCP","590","60304  >  3000 [PSH, ACK] Seq=8074 Ack=913 Win=1768 Len=536 [TCP PDU reassembled in 287]"
"285","41.636437300","10.85.52.177","10.85.52.122","TCP","170","60304  >  3000 [PSH, ACK] Seq=8610 Ack=913 Win=1768 Len=116 [TCP PDU reassembled in 287]"
"286","41.636606300","10.85.52.122","10.85.52.177","TCP","54","3000  >  60304 [ACK] Seq=913 Ack=8610 Win=65392 Len=0"
"287","41.650614200","10.85.52.177","10.85.52.122","HTTP","405","POST /api/data/large HTTP/1.1 "
"288","41.650614200","10.85.52.177","10.85.52.122","TCP","240","60304  >  3000 [PSH, ACK] Seq=9077 Ack=913 Win=1768 Len=186 [TCP PDU reassembled in 299]"
"289","41.650879500","10.85.52.122","10.85.52.177","TCP","54","3000  >  60304 [ACK] Seq=913 Ack=9077 Win=64925 Len=0"
"290","41.651801200","10.85.52.122","10.85.52.177","HTTP","282","HTTP/1.1 200 OK  (text/html)"
"291","41.653763200","10.85.52.177","10.85.52.122","TCP","473","60304  >  3000 [PSH, ACK] Seq=9263 Ack=913 Win=1768 Len=419 [TCP PDU reassembled in 299]"
"293","41.660643700","10.85.52.177","10.85.52.122","TCP","521","60304  >  3000 [PSH, ACK] Seq=9682 Ack=913 Win=1768 Len=467 [TCP PDU reassembled in 299]"
"294","41.660643700","10.85.52.177","10.85.52.122","TCP","240","60304  >  3000 [PSH, ACK] Seq=10149 Ack=1141 Win=1540 Len=186 [TCP PDU reassembled in 299]"
"295","41.660970000","10.85.52.122","10.85.52.177","TCP","54","3000  >  60304 [ACK] Seq=1141 Ack=10149 Win=65392 Len=0"
"296","41.670982600","10.85.52.177","10.85.52.122","TCP","590","60304  >  3000 [ACK] Seq=10335 Ack=1141 Win=1540 Len=536 [TCP PDU reassembled in 299]"
"297","41.671164400","10.85.52.122","10.85.52.177","TCP","54","3000  >  60304 [ACK] Seq=1141 Ack=10871 Win=65392 Len=0"
"298","41.673338500","10.85.52.177","10.85.52.122","TCP","404","60304  >  3000 [PSH, ACK] Seq=10871 Ack=1141 Win=1540 Len=350 [TCP PDU reassembled in 299]"
"299","41.689658700","10.85.52.177","10.85.52.122","HTTP","171","POST /api/data/large HTTP/1.1 "
"300","41.689658700","10.85.52.177","10.85.52.122","TCP","54","[TCP Window Update] 60304  >  3000 [ACK] Seq=11338 Ack=1141 Win=2076 Len=0"
"301","41.689991400","10.85.52.122","10.85.52.177","TCP","54","3000  >  60304 [ACK] Seq=1141 Ack=11338 Win=64925 Len=0"
"302","41.691714300","10.85.52.177","10.85.52.122","TCP","240","60304  >  3000 [PSH, ACK] Seq=11338 Ack=1141 Win=2076 Len=186 [TCP PDU reassembled in 311]"
"303","41.692427600","10.85.52.122","10.85.52.177","HTTP","282","HTTP/1.1 200 OK  (text/html)"
"304","41.693577900","10.85.52.177","10.85.52.122","TCP","473","60304  >  3000 [PSH, ACK] Seq=11524 Ack=1141 Win=2076 Len=419 [TCP PDU reassembled in 311]"
"305","41.703864400","10.85.52.177","10.85.52.122","TCP","590","60304  >  3000 [ACK] Seq=11943 Ack=1369 Win=1848 Len=536 [TCP PDU reassembled in 311]"
"306","41.703864400","10.85.52.177","10.85.52.122","TCP","171","60304  >  3000 [PSH, ACK] Seq=12479 Ack=1369 Win=1848 Len=117 [TCP PDU reassembled in 311]"
"307","41.704132700","10.85.52.122","10.85.52.177","TCP","54","3000  >  60304 [ACK] Seq=1369 Ack=12479 Win=65392 Len=0"
"308","41.713260800","10.85.52.177","10.85.52.122","TCP","590","60304  >  3000 [ACK] Seq=12596 Ack=1369 Win=1848 Len=536 [TCP PDU reassembled in 311]"
"309","41.713420100","10.85.52.122","10.85.52.177","TCP","54","3000  >  60304 [ACK] Seq=1369 Ack=13132 Win=65392 Len=0"
"310","41.716566900","10.85.52.177","10.85.52.122","TCP","473","60304  >  3000 [PSH, ACK] Seq=13132 Ack=1369 Win=1848 Len=419 [TCP PDU reassembled in 311]"
"311","41.727462800","10.85.52.177","10.85.52.122","HTTP","102","POST /api/data/large HTTP/1.1 "
"312","41.727462800","10.85.52.177","10.85.52.122","TCP","240","60304  >  3000 [PSH, ACK] Seq=13599 Ack=1369 Win=1848 Len=186 [TCP PDU reassembled in 322]"
"313","41.727688900","10.85.52.122","10.85.52.177","TCP","54","3000  >  60304 [ACK] Seq=1369 Ack=13599 Win=64925 Len=0"
"314","41.728818500","10.85.52.122","10.85.52.177","HTTP","282","HTTP/1.1 200 OK  (text/html)"
"315","41.730659500","10.85.52.177","10.85.52.122","TCP","473","60304  >  3000 [PSH, ACK] Seq=13785 Ack=1369 Win=1848 Len=419 [TCP PDU reassembled in 322]"
"316","41.738401700","10.85.52.177","10.85.52.122","TCP","590","60304  >  3000 [ACK] Seq=14204 Ack=1597 Win=1620 Len=536 [TCP PDU reassembled in 322]"
"317","41.738401700","10.85.52.177","10.85.52.122","TCP","171","60304  >  3000 [PSH, ACK] Seq=14740 Ack=1597 Win=1620 Len=117 [TCP PDU reassembled in 322]"
"318","41.738711600","10.85.52.122","10.85.52.177","TCP","54","3000  >  60304 [ACK] Seq=1597 Ack=14740 Win=65392 Len=0"
"319","41.752399100","10.85.52.177","10.85.52.122","TCP","590","60304  >  3000 [ACK] Seq=14857 Ack=1597 Win=1620 Len=536 [TCP PDU reassembled in 322]"
"320","41.752399100","10.85.52.177","10.85.52.122","TCP","473","60304  >  3000 [PSH, ACK] Seq=15393 Ack=1597 Win=1620 Len=419 [TCP PDU reassembled in 322]"
"321","41.752707500","10.85.52.122","10.85.52.177","TCP","54","3000  >  60304 [ACK] Seq=1597 Ack=15393 Win=65392 Len=0"
"322","41.766813400","10.85.52.177","10.85.52.122","HTTP","102","POST /api/data/large HTTP/1.1 "
"323","41.766813400","10.85.52.177","10.85.52.122","TCP","240","60304  >  3000 [PSH, ACK] Seq=15860 Ack=1597 Win=1620 Len=186 [TCP PDU reassembled in 417]"
"324","41.767110900","10.85.52.122","10.85.52.177","TCP","54","3000  >  60304 [ACK] Seq=1597 Ack=15860 Win=64925 Len=0"
"325","41.768211400","10.85.52.122","10.85.52.177","HTTP","282","HTTP/1.1 200 OK  (text/html)"
"326","41.768460400","10.85.52.177","10.85.52.122","TCP","473","60304  >  3000 [PSH, ACK] Seq=16046 Ack=1597 Win=1620 Len=419 [TCP PDU reassembled in 417]"
"328","41.777691000","10.85.52.177","10.85.52.122","TCP","590","60304  >  3000 [ACK] Seq=16465 Ack=1825 Win=1392 Len=536 [TCP PDU reassembled in 417]"
"329","41.777691000","10.85.52.177","10.85.52.122","TCP","171","60304  >  3000 [PSH, ACK] Seq=17001 Ack=1825 Win=1392 Len=117 [TCP PDU reassembled in 417]"
"330","41.777943500","10.85.52.122","10.85.52.177","TCP","54","3000  >  60304 [ACK] Seq=1825 Ack=17001 Win=65392 Len=0"
"333","41.791783800","10.85.52.177","10.85.52.122","TCP","590","60304  >  3000 [ACK] Seq=17118 Ack=1825 Win=1392 Len=536 [TCP PDU reassembled in 417]"
"339","41.792467300","10.85.52.122","10.85.52.177","TCP","54","3000  >  60304 [ACK] Seq=1825 Ack=17654 Win=65392 Len=0"
"357","41.795647700","10.85.52.177","10.85.52.122","TCP","473","60304  >  3000 [PSH, ACK] Seq=17654 Ack=1825 Win=1392 Len=419 [TCP PDU reassembled in 417]"
"417","41.811644100","10.85.52.177","10.85.52.122","HTTP","102","POST /api/data/large HTTP/1.1 "
"419","41.811644100","10.85.52.177","10.85.52.122","TCP","54","[TCP Window Update] 60304  >  3000 [ACK] Seq=18121 Ack=1825 Win=1928 Len=0"
"420","41.811644100","10.85.52.177","10.85.52.122","TCP","240","60304  >  3000 [PSH, ACK] Seq=18121 Ack=1825 Win=1928 Len=186 [TCP PDU reassembled in 472]"
"421","41.811870600","10.85.52.122","10.85.52.177","TCP","54","3000  >  60304 [ACK] Seq=1825 Ack=18121 Win=64925 Len=0"
"423","41.812664600","10.85.52.122","10.85.52.177","HTTP","282","HTTP/1.1 200 OK  (text/html)"
"424","41.814101400","10.85.52.177","10.85.52.122","TCP","473","60304  >  3000 [PSH, ACK] Seq=18307 Ack=1825 Win=1928 Len=419 [TCP PDU reassembled in 472]"
"466","41.828419600","10.85.52.177","10.85.52.122","TCP","521","60304  >  3000 [PSH, ACK] Seq=18726 Ack=1825 Win=1928 Len=467 [TCP PDU reassembled in 472]"
"467","41.828419600","10.85.52.177","10.85.52.122","TCP","240","60304  >  3000 [PSH, ACK] Seq=19193 Ack=2053 Win=1700 Len=186 [TCP PDU reassembled in 472]"
"468","41.828508900","10.85.52.122","10.85.52.177","TCP","54","3000  >  60304 [ACK] Seq=2053 Ack=19193 Win=65392 Len=0"
"469","41.836897600","10.85.52.177","10.85.52.122","TCP","590","60304  >  3000 [ACK] Seq=19379 Ack=2053 Win=1700 Len=536 [TCP PDU reassembled in 472]"
"470","41.837045200","10.85.52.122","10.85.52.177","TCP","54","3000  >  60304 [ACK] Seq=2053 Ack=19915 Win=65392 Len=0"
"471","41.844005300","10.85.52.177","10.85.52.122","TCP","404","60304  >  3000 [PSH, ACK] Seq=19915 Ack=2053 Win=1700 Len=350 [TCP PDU reassembled in 472]"
"472","41.851210600","10.85.52.177","10.85.52.122","HTTP","171","POST /api/data/large HTTP/1.1 "
"473","41.851210600","10.85.52.177","10.85.52.122","TCP","240","60304  >  3000 [PSH, ACK] Seq=20382 Ack=2053 Win=1700 Len=186 [TCP PDU reassembled in 487]"
"474","41.851452000","10.85.52.122","10.85.52.177","TCP","54","3000  >  60304 [ACK] Seq=2053 Ack=20382 Win=64925 Len=0"
"475","41.852361500","10.85.52.122","10.85.52.177","HTTP","282","HTTP/1.1 200 OK  (text/html)"
"476","41.852748900","10.85.52.177","10.85.52.122","TCP","473","60304  >  3000 [PSH, ACK] Seq=20568 Ack=2053 Win=1700 Len=419 [TCP PDU reassembled in 487]"
"477","41.861707300","10.85.52.177","10.85.52.122","TCP","590","60304  >  3000 [ACK] Seq=20987 Ack=2281 Win=1472 Len=536 [TCP PDU reassembled in 487]"
"478","41.861950100","10.85.52.122","10.85.52.177","TCP","54","3000  >  60304 [ACK] Seq=2281 Ack=21523 Win=65392 Len=0"
"479","41.863784100","10.85.52.177","10.85.52.122","TCP","171","60304  >  3000 [PSH, ACK] Seq=21523 Ack=2281 Win=1472 Len=117 [TCP PDU reassembled in 487]"
"483","41.873743700","10.85.52.177","10.85.52.122","TCP","590","60304  >  3000 [ACK] Seq=21640 Ack=2281 Win=1472 Len=536 [TCP PDU reassembled in 487]"
"484","41.873743700","10.85.52.177","10.85.52.122","TCP","473","60304  >  3000 [PSH, ACK] Seq=22176 Ack=2281 Win=1472 Len=419 [TCP PDU reassembled in 487]"
"485","41.874019000","10.85.52.122","10.85.52.177","TCP","54","3000  >  60304 [ACK] Seq=2281 Ack=22176 Win=65392 Len=0"
"487","41.890412500","10.85.52.177","10.85.52.122","HTTP","102","POST /api/data/large HTTP/1.1 "
"488","41.890412500","10.85.52.177","10.85.52.122","TCP","54","[TCP Window Update] 60304  >  3000 [ACK] Seq=22643 Ack=2281 Win=2008 Len=0"
"493","41.890709300","10.85.52.122","10.85.52.177","TCP","54","3000  >  60304 [ACK] Seq=2281 Ack=22643 Win=64925 Len=0"
"495","41.896263900","10.85.52.177","10.85.52.122","TCP","240","60304  >  3000 [PSH, ACK] Seq=22643 Ack=2281 Win=2008 Len=186 [TCP PDU reassembled in 505]"
"497","41.897100100","10.85.52.122","10.85.52.177","HTTP","282","HTTP/1.1 200 OK  (text/html)"
"498","41.898414700","10.85.52.177","10.85.52.122","TCP","473","60304  >  3000 [PSH, ACK] Seq=22829 Ack=2281 Win=2008 Len=419 [TCP PDU reassembled in 505]"
"499","41.905627700","10.85.52.177","10.85.52.122","TCP","521","60304  >  3000 [PSH, ACK] Seq=23248 Ack=2281 Win=2008 Len=467 [TCP PDU reassembled in 505]"
"500","41.905627700","10.85.52.177","10.85.52.122","TCP","240","60304  >  3000 [PSH, ACK] Seq=23715 Ack=2509 Win=1780 Len=186 [TCP PDU reassembled in 505]"
"501","41.905985900","10.85.52.122","10.85.52.177","TCP","54","3000  >  60304 [ACK] Seq=2509 Ack=23715 Win=65392 Len=0"
"502","41.916529000","10.85.52.177","10.85.52.122","TCP","590","60304  >  3000 [ACK] Seq=23901 Ack=2509 Win=1780 Len=536 [TCP PDU reassembled in 505]"
"503","41.916805600","10.85.52.122","10.85.52.177","TCP","54","3000  >  60304 [ACK] Seq=2509 Ack=24437 Win=65392 Len=0"
"504","41.918021600","10.85.52.177","10.85.52.122","TCP","404","60304  >  3000 [PSH, ACK] Seq=24437 Ack=2509 Win=1780 Len=350 [TCP PDU reassembled in 505]"
"505","41.929552500","10.85.52.177","10.85.52.122","HTTP","171","POST /api/data/large HTTP/1.1 "
"506","41.929552500","10.85.52.177","10.85.52.122","TCP","240","60304  >  3000 [PSH, ACK] Seq=24904 Ack=2509 Win=1780 Len=186 [TCP PDU reassembled in 516]"
"507","41.929805800","10.85.52.122","10.85.52.177","TCP","54","3000  >  60304 [ACK] Seq=2509 Ack=24904 Win=64925 Len=0"
"508","41.930564400","10.85.52.122","10.85.52.177","HTTP","282","HTTP/1.1 200 OK  (text/html)"
"509","41.933995300","10.85.52.177","10.85.52.122","TCP","473","60304  >  3000 [PSH, ACK] Seq=25090 Ack=2509 Win=1780 Len=419 [TCP PDU reassembled in 516]"
"510","41.940806700","10.85.52.177","10.85.52.122","TCP","521","60304  >  3000 [PSH, ACK] Seq=25509 Ack=2509 Win=1780 Len=467 [TCP PDU reassembled in 516]"
"511","41.940806700","10.85.52.177","10.85.52.122","TCP","240","60304  >  3000 [PSH, ACK] Seq=25976 Ack=2737 Win=1552 Len=186 [TCP PDU reassembled in 516]"
"512","41.941151300","10.85.52.122","10.85.52.177","TCP","54","3000  >  60304 [ACK] Seq=2737 Ack=25976 Win=65392 Len=0"
"513","41.950204700","10.85.52.177","10.85.52.122","TCP","590","60304  >  3000 [ACK] Seq=26162 Ack=2737 Win=1552 Len=536 [TCP PDU reassembled in 516]"
"514","41.950465800","10.85.52.122","10.85.52.177","TCP","54","3000  >  60304 [ACK] Seq=2737 Ack=26698 Win=65392 Len=0"
"515","41.954047700","10.85.52.177","10.85.52.122","TCP","404","60304  >  3000 [PSH, ACK] Seq=26698 Ack=2737 Win=1552 Len=350 [TCP PDU reassembled in 516]"
"516","41.964446700","10.85.52.177","10.85.52.122","HTTP","171","POST /api/data/large HTTP/1.1 "
"517","41.964446700","10.85.52.177","10.85.52.122","TCP","54","[TCP Window Update] 60304  >  3000 [ACK] Seq=27165 Ack=2737 Win=2088 Len=0"
"518","41.964700100","10.85.52.122","10.85.52.177","TCP","54","3000  >  60304 [ACK] Seq=2737 Ack=27165 Win=64925 Len=0"
"519","41.968167700","10.85.52.177","10.85.52.122","TCP","240","60304  >  3000 [PSH, ACK] Seq=27165 Ack=2737 Win=2088 Len=186 [TCP PDU reassembled in 528]"
"520","41.968167700","10.85.52.177","10.85.52.122","TCP","473","60304  >  3000 [PSH, ACK] Seq=27351 Ack=2737 Win=2088 Len=419 [TCP PDU reassembled in 528]"
"521","41.968435400","10.85.52.122","10.85.52.177","TCP","54","3000  >  60304 [ACK] Seq=2737 Ack=27770 Win=65392 Len=0"
"522","41.969351500","10.85.52.122","10.85.52.177","HTTP","282","HTTP/1.1 200 OK  (text/html)"
"523","41.977266000","10.85.52.177","10.85.52.122","TCP","521","60304  >  3000 [PSH, ACK] Seq=27770 Ack=2737 Win=2088 Len=467 [TCP PDU reassembled in 528]"
"524","41.979782900","10.85.52.177","10.85.52.122","TCP","590","60304  >  3000 [ACK] Seq=28237 Ack=2737 Win=2088 Len=536 [TCP PDU reassembled in 528]"
"525","41.979782900","10.85.52.177","10.85.52.122","TCP","123","60304  >  3000 [PSH, ACK] Seq=28773 Ack=2737 Win=2088 Len=69 [TCP PDU reassembled in 528]"
"526","41.979979600","10.85.52.122","10.85.52.177","TCP","54","3000  >  60304 [ACK] Seq=2965 Ack=28773 Win=65392 Len=0"
"527","41.996378900","10.85.52.177","10.85.52.122","TCP","590","60304  >  3000 [ACK] Seq=28842 Ack=2965 Win=1860 Len=536 [TCP PDU reassembled in 528]"
"528","41.996378900","10.85.52.177","10.85.52.122","HTTP","102","POST /api/data/large HTTP/1.1 "
"529","41.996658000","10.85.52.122","10.85.52.177","TCP","54","3000  >  60304 [ACK] Seq=2965 Ack=29378 Win=65392 Len=0"
"530","42.000231600","10.85.52.177","10.85.52.122","TCP","240","60304  >  3000 [PSH, ACK] Seq=29426 Ack=2965 Win=1860 Len=186 [TCP PDU reassembled in 542]"
"531","42.000231600","10.85.52.177","10.85.52.122","TCP","287","60304  >  3000 [PSH, ACK] Seq=29612 Ack=2965 Win=1860 Len=233 [TCP PDU reassembled in 542]"
"532","42.000613200","10.85.52.122","10.85.52.177","TCP","54","3000  >  60304 [ACK] Seq=2965 Ack=29612 Win=65158 Len=0"
"533","42.001520500","10.85.52.122","10.85.52.177","HTTP","282","HTTP/1.1 200 OK  (text/html)"
"534","42.009093500","10.85.52.177","10.85.52.122","TCP","590","60304  >  3000 [ACK] Seq=29845 Ack=2965 Win=1860 Len=536 [TCP PDU reassembled in 542]"
"535","42.009393600","10.85.52.122","10.85.52.177","TCP","54","3000  >  60304 [ACK] Seq=3193 Ack=30381 Win=65392 Len=0"
"536","42.012465900","10.85.52.177","10.85.52.122","TCP","123","60304  >  3000 [PSH, ACK] Seq=30381 Ack=2965 Win=1860 Len=69 [TCP PDU reassembled in 542]"
"537","42.012710300","10.85.52.122","10.85.52.177","TCP","54","3000  >  60304 [ACK] Seq=3193 Ack=30450 Win=65323 Len=0"
"538","42.016133300","10.85.52.177","10.85.52.122","TCP","521","60304  >  3000 [PSH, ACK] Seq=30450 Ack=3193 Win=1632 Len=467 [TCP PDU reassembled in 542]"
"539","42.019632600","10.85.52.177","10.85.52.122","TCP","590","60304  >  3000 [PSH, ACK] Seq=30917 Ack=3193 Win=1632 Len=536 [TCP PDU reassembled in 542]"
"540","42.019852900","10.85.52.122","10.85.52.177","TCP","54","3000  >  60304 [ACK] Seq=3193 Ack=31453 Win=65392 Len=0"
"541","42.022819000","10.85.52.177","10.85.52.122","TCP","123","60304  >  3000 [PSH, ACK] Seq=31453 Ack=3193 Win=1632 Len=69 [TCP PDU reassembled in 542]"
"542","42.032557400","10.85.52.177","10.85.52.122","HTTP","219","POST /api/data/large HTTP/1.1 "
"543","42.032557400","10.85.52.177","10.85.52.122","TCP","240","60304  >  3000 [PSH, ACK] Seq=31687 Ack=3193 Win=1632 Len=186 [TCP PDU reassembled in 554]"
"544","42.032820300","10.85.52.122","10.85.52.177","TCP","54","3000  >  60304 [ACK] Seq=3193 Ack=31687 Win=65158 Len=0"
"545","42.033473100","10.85.52.122","10.85.52.177","HTTP","282","HTTP/1.1 200 OK  (text/html)"
"546","42.036395100","10.85.52.177","10.85.52.122","TCP","590","60304  >  3000 [ACK] Seq=31873 Ack=3193 Win=1632 Len=536 [TCP PDU reassembled in 554]"
"547","42.036538700","10.85.52.122","10.85.52.177","TCP","54","3000  >  60304 [ACK] Seq=3421 Ack=32409 Win=65392 Len=0"
"548","42.039362700","10.85.52.177","10.85.52.122","TCP","170","60304  >  3000 [PSH, ACK] Seq=32409 Ack=3193 Win=1632 Len=116 [TCP PDU reassembled in 554]"
"549","42.039455900","10.85.52.122","10.85.52.177","TCP","54","3000  >  60304 [ACK] Seq=3421 Ack=32525 Win=65276 Len=0"
"550","42.048700600","10.85.52.177","10.85.52.122","TCP","474","60304  >  3000 [PSH, ACK] Seq=32525 Ack=3421 Win=1404 Len=420 [TCP PDU reassembled in 554]"
"551","42.048700600","10.85.52.177","10.85.52.122","TCP","590","60304  >  3000 [PSH, ACK] Seq=32945 Ack=3421 Win=1404 Len=536 [TCP PDU reassembled in 554]"
"552","42.048700600","10.85.52.177","10.85.52.122","TCP","170","60304  >  3000 [PSH, ACK] Seq=33481 Ack=3421 Win=1404 Len=116 [TCP PDU reassembled in 554]"
"553","42.049019400","10.85.52.122","10.85.52.177","TCP","54","3000  >  60304 [ACK] Seq=3421 Ack=33481 Win=65392 Len=0"
"554","42.062074600","10.85.52.177","10.85.52.122","HTTP","405","POST /api/data/large HTTP/1.1 "
"555","42.062074600","10.85.52.177","10.85.52.122","TCP","54","[TCP Window Update] 60304  >  3000 [ACK] Seq=33948 Ack=3421 Win=1940 Len=0"
"556","42.062074600","10.85.52.177","10.85.52.122","TCP","240","60304  >  3000 [PSH, ACK] Seq=33948 Ack=3421 Win=1940 Len=186 [TCP PDU reassembled in 566]"
"557","42.062370600","10.85.52.122","10.85.52.177","TCP","54","3000  >  60304 [ACK] Seq=3421 Ack=33948 Win=64925 Len=0"
"558","42.063357700","10.85.52.122","10.85.52.177","HTTP","282","HTTP/1.1 200 OK  (text/html)"
"559","42.065314900","10.85.52.177","10.85.52.122","TCP","473","60304  >  3000 [PSH, ACK] Seq=34134 Ack=3421 Win=1940 Len=419 [TCP PDU reassembled in 566]"
"560","42.072786200","10.85.52.177","10.85.52.122","TCP","590","60304  >  3000 [ACK] Seq=34553 Ack=3649 Win=1712 Len=536 [TCP PDU reassembled in 566]"
"561","42.072786200","10.85.52.177","10.85.52.122","TCP","171","60304  >  3000 [PSH, ACK] Seq=35089 Ack=3649 Win=1712 Len=117 [TCP PDU reassembled in 566]"
"562","42.073060800","10.85.52.122","10.85.52.177","TCP","54","3000  >  60304 [ACK] Seq=3649 Ack=35089 Win=65392 Len=0"
"563","42.082513800","10.85.52.177","10.85.52.122","TCP","590","60304  >  3000 [ACK] Seq=35206 Ack=3649 Win=1712 Len=536 [TCP PDU reassembled in 566]"
"564","42.082765500","10.85.52.122","10.85.52.177","TCP","54","3000  >  60304 [ACK] Seq=3649 Ack=35742 Win=65392 Len=0"
"565","42.084942000","10.85.52.177","10.85.52.122","TCP","473","60304  >  3000 [PSH, ACK] Seq=35742 Ack=3649 Win=1712 Len=419 [TCP PDU reassembled in 566]"
"566","42.099687300","10.85.52.177","10.85.52.122","HTTP","102","POST /api/data/large HTTP/1.1 "
"567","42.099687300","10.85.52.177","10.85.52.122","TCP","240","60304  >  3000 [PSH, ACK] Seq=36209 Ack=3649 Win=1712 Len=186 [TCP PDU reassembled in 577]"
"568","42.100033200","10.85.52.122","10.85.52.177","TCP","54","3000  >  60304 [ACK] Seq=3649 Ack=36209 Win=64925 Len=0"
"569","42.100990900","10.85.52.122","10.85.52.177","HTTP","282","HTTP/1.1 200 OK  (text/html)"
"570","42.103020500","10.85.52.177","10.85.52.122","TCP","473","60304  >  3000 [PSH, ACK] Seq=36395 Ack=3649 Win=1712 Len=419 [TCP PDU reassembled in 577]"
"571","42.113727000","10.85.52.177","10.85.52.122","TCP","590","60304  >  3000 [ACK] Seq=36814 Ack=3877 Win=1484 Len=536 [TCP PDU reassembled in 577]"
"572","42.113727000","10.85.52.177","10.85.52.122","TCP","171","60304  >  3000 [PSH, ACK] Seq=37350 Ack=3877 Win=1484 Len=117 [TCP PDU reassembled in 577]"
"573","42.114055700","10.85.52.122","10.85.52.177","TCP","54","3000  >  60304 [ACK] Seq=3877 Ack=37350 Win=65392 Len=0"
"574","42.123354500","10.85.52.177","10.85.52.122","TCP","590","60304  >  3000 [ACK] Seq=37467 Ack=3877 Win=1484 Len=536 [TCP PDU reassembled in 577]"
"575","42.123610300","10.85.52.122","10.85.52.177","TCP","54","3000  >  60304 [ACK] Seq=3877 Ack=38003 Win=65392 Len=0"
"576","42.125332700","10.85.52.177","10.85.52.122","TCP","473","60304  >  3000 [PSH, ACK] Seq=38003 Ack=3877 Win=1484 Len=419 [TCP PDU reassembled in 577]"
"577","42.137072900","10.85.52.177","10.85.52.122","HTTP","102","POST /api/data/large HTTP/1.1 "
"578","42.137072900","10.85.52.177","10.85.52.122","TCP","54","[TCP Window Update] 60304  >  3000 [ACK] Seq=38470 Ack=3877 Win=2020 Len=0"
"579","42.137325900","10.85.52.122","10.85.52.177","TCP","54","3000  >  60304 [ACK] Seq=3877 Ack=38470 Win=64925 Len=0"
"580","42.139098100","10.85.52.177","10.85.52.122","TCP","240","60304  >  3000 [PSH, ACK] Seq=38470 Ack=3877 Win=2020 Len=186 [TCP PDU reassembled in 589]"
"581","42.139098100","10.85.52.177","10.85.52.122","TCP","473","60304  >  3000 [PSH, ACK] Seq=38656 Ack=3877 Win=2020 Len=419 [TCP PDU reassembled in 589]"
"582","42.139409200","10.85.52.122","10.85.52.177","TCP","54","3000  >  60304 [ACK] Seq=3877 Ack=39075 Win=65392 Len=0"
"583","42.139913600","10.85.52.122","10.85.52.177","HTTP","282","HTTP/1.1 200 OK  (text/html)"
"584","42.147997400","10.85.52.177","10.85.52.122","TCP","521","60304  >  3000 [PSH, ACK] Seq=39075 Ack=3877 Win=2020 Len=467 [TCP PDU reassembled in 589]"
"585","42.149702900","10.85.52.177","10.85.52.122","TCP","590","60304  >  3000 [ACK] Seq=39542 Ack=4105 Win=1792 Len=536 [TCP PDU reassembled in 589]"
"586","42.149702900","10.85.52.177","10.85.52.122","TCP","123","60304  >  3000 [PSH, ACK] Seq=40078 Ack=4105 Win=1792 Len=69 [TCP PDU reassembled in 589]"
"587","42.149840700","10.85.52.122","10.85.52.177","TCP","54","3000  >  60304 [ACK] Seq=4105 Ack=40078 Win=65392 Len=0"
"588","42.162180200","10.85.52.177","10.85.52.122","TCP","590","60304  >  3000 [ACK] Seq=40147 Ack=4105 Win=1792 Len=536 [TCP PDU reassembled in 589]"
"589","42.162180200","10.85.52.177","10.85.52.122","HTTP","102","POST /api/data/large HTTP/1.1 "
"590","42.162442900","10.85.52.122","10.85.52.177","TCP","54","3000  >  60304 [ACK] Seq=4105 Ack=40683 Win=65392 Len=0"
"591","42.164074200","10.85.52.177","10.85.52.122","TCP","240","60304  >  3000 [PSH, ACK] Seq=40731 Ack=4105 Win=1792 Len=186 [TCP PDU reassembled in 603]"
"592","42.164074200","10.85.52.177","10.85.52.122","TCP","287","60304  >  3000 [PSH, ACK] Seq=40917 Ack=4105 Win=1792 Len=233 [TCP PDU reassembled in 603]"
"593","42.164321100","10.85.52.122","10.85.52.177","TCP","54","3000  >  60304 [ACK] Seq=4105 Ack=40917 Win=65158 Len=0"
"594","42.165296900","10.85.52.122","10.85.52.177","HTTP","282","HTTP/1.1 200 OK  (text/html)"
"595","42.173557500","10.85.52.177","10.85.52.122","TCP","590","60304  >  3000 [ACK] Seq=41150 Ack=4105 Win=1792 Len=536 [TCP PDU reassembled in 603]"
"596","42.173557500","10.85.52.177","10.85.52.122","TCP","123","60304  >  3000 [PSH, ACK] Seq=41686 Ack=4105 Win=1792 Len=69 [TCP PDU reassembled in 603]"
"597","42.173830500","10.85.52.122","10.85.52.177","TCP","54","3000  >  60304 [ACK] Seq=4333 Ack=41686 Win=65392 Len=0"
"598","42.174000200","10.85.52.122","10.85.52.177","TCP","54","3000  >  60304 [ACK] Seq=4333 Ack=41755 Win=65323 Len=0"
"599","42.176659600","10.85.52.177","10.85.52.122","TCP","288","60304  >  3000 [PSH, ACK] Seq=41755 Ack=4105 Win=1792 Len=234 [TCP PDU reassembled in 603]"
"600","42.176659600","10.85.52.177","10.85.52.122","TCP","287","60304  >  3000 [PSH, ACK] Seq=41989 Ack=4333 Win=1564 Len=233 [TCP PDU reassembled in 603]"
"601","42.176837600","10.85.52.122","10.85.52.177","TCP","54","3000  >  60304 [ACK] Seq=4333 Ack=42222 Win=65392 Len=0"
"602","42.216566400","10.85.52.177","10.85.52.122","TCP","590","60304  >  3000 [ACK] Seq=42222 Ack=4333 Win=1564 Len=536 [TCP PDU reassembled in 603]"
"603","42.216566400","10.85.52.177","10.85.52.122","HTTP","288","POST /api/data/large HTTP/1.1 "
"604","42.216566400","10.85.52.177","10.85.52.122","TCP","54","[TCP Window Update] 60304  >  3000 [ACK] Seq=42992 Ack=4333 Win=2100 Len=0"
"605","42.216725600","10.85.52.122","10.85.52.177","TCP","54","3000  >  60304 [ACK] Seq=4333 Ack=42992 Win=65392 Len=0"
"606","42.219562600","10.85.52.177","10.85.52.122","TCP","240","60304  >  3000 [PSH, ACK] Seq=42992 Ack=4333 Win=2100 Len=186 [TCP PDU reassembled in 618]"
"607","42.219562600","10.85.52.177","10.85.52.122","TCP","170","60304  >  3000 [PSH, ACK] Seq=43178 Ack=4333 Win=2100 Len=116 [TCP PDU reassembled in 618]"
"608","42.219844900","10.85.52.122","10.85.52.177","TCP","54","3000  >  60304 [ACK] Seq=4333 Ack=43294 Win=65090 Len=0"
"609","42.220686300","10.85.52.122","10.85.52.177","HTTP","282","HTTP/1.1 200 OK  (text/html)"
"610","42.227983000","10.85.52.177","10.85.52.122","TCP","590","60304  >  3000 [ACK] Seq=43294 Ack=4333 Win=2100 Len=536 [TCP PDU reassembled in 618]"
"611","42.227983000","10.85.52.177","10.85.52.122","TCP","288","60304  >  3000 [PSH, ACK] Seq=43830 Ack=4333 Win=2100 Len=234 [TCP PDU reassembled in 618]"
"612","42.228278800","10.85.52.122","10.85.52.177","TCP","54","3000  >  60304 [ACK] Seq=4561 Ack=43830 Win=65392 Len=0"
"613","42.228479700","10.85.52.122","10.85.52.177","TCP","54","3000  >  60304 [ACK] Seq=4561 Ack=44064 Win=65158 Len=0"
"614","42.230017700","10.85.52.177","10.85.52.122","TCP","356","60304  >  3000 [PSH, ACK] Seq=44064 Ack=4561 Win=1872 Len=302 [TCP PDU reassembled in 618]"
"615","42.239163100","10.85.52.177","10.85.52.122","TCP","590","60304  >  3000 [ACK] Seq=44366 Ack=4561 Win=1872 Len=536 [TCP PDU reassembled in 618]"
"616","42.239354600","10.85.52.122","10.85.52.177","TCP","54","3000  >  60304 [ACK] Seq=4561 Ack=44902 Win=65392 Len=0"
"617","42.242274100","10.85.52.177","10.85.52.122","TCP","288","60304  >  3000 [PSH, ACK] Seq=44902 Ack=4561 Win=1872 Len=234 [TCP PDU reassembled in 618]"
"618","42.251246300","10.85.52.177","10.85.52.122","HTTP","171","POST /api/data/large HTTP/1.1 "
"619","42.251435200","10.85.52.122","10.85.52.177","TCP","54","3000  >  60304 [ACK] Seq=4561 Ack=45253 Win=65041 Len=0"
"620","42.254362000","10.85.52.177","10.85.52.122","TCP","240","60304  >  3000 [PSH, ACK] Seq=45253 Ack=4561 Win=1872 Len=186 [TCP PDU reassembled in 629]"
"621","42.255394400","10.85.52.122","10.85.52.177","HTTP","282","HTTP/1.1 200 OK  (text/html)"
"622","42.258246700","10.85.52.177","10.85.52.122","TCP","589","60304  >  3000 [PSH, ACK] Seq=45439 Ack=4561 Win=1872 Len=535 [TCP PDU reassembled in 629]"
"623","42.262625300","10.85.52.177","10.85.52.122","TCP","405","60304  >  3000 [PSH, ACK] Seq=45974 Ack=4561 Win=1872 Len=351 [TCP PDU reassembled in 629]"
"624","42.262946900","10.85.52.122","10.85.52.177","TCP","54","3000  >  60304 [ACK] Seq=4789 Ack=46325 Win=65392 Len=0"
"625","42.266260700","10.85.52.177","10.85.52.122","TCP","240","60304  >  3000 [PSH, ACK] Seq=46325 Ack=4789 Win=1644 Len=186 [TCP PDU reassembled in 629]"
"626","42.272565800","10.85.52.177","10.85.52.122","TCP","590","60304  >  3000 [ACK] Seq=46511 Ack=4789 Win=1644 Len=536 [TCP PDU reassembled in 629]"
"627","42.272771800","10.85.52.122","10.85.52.177","TCP","54","3000  >  60304 [ACK] Seq=4789 Ack=47047 Win=65392 Len=0"
"628","42.280611500","10.85.52.177","10.85.52.122","TCP","404","60304  >  3000 [PSH, ACK] Seq=47047 Ack=4789 Win=1644 Len=350 [TCP PDU reassembled in 629]"
"629","42.306919700","10.85.52.177","10.85.52.122","HTTP","171","POST /api/data/large HTTP/1.1 "
"630","42.307170000","10.85.52.122","10.85.52.177","TCP","54","3000  >  60304 [ACK] Seq=4789 Ack=47514 Win=64925 Len=0"
"631","42.315248700","10.85.52.177","10.85.52.122","TCP","240","60304  >  3000 [PSH, ACK] Seq=47514 Ack=4789 Win=1644 Len=186 [TCP PDU reassembled in 640]"
"632","42.316333600","10.85.52.122","10.85.52.177","HTTP","282","HTTP/1.1 200 OK  (text/html)"
"633","42.317270600","10.85.52.177","10.85.52.122","TCP","473","60304  >  3000 [PSH, ACK] Seq=47700 Ack=4789 Win=1644 Len=419 [TCP PDU reassembled in 640]"
"634","42.319713500","10.85.52.177","10.85.52.122","TCP","521","60304  >  3000 [PSH, ACK] Seq=48119 Ack=4789 Win=1644 Len=467 [TCP PDU reassembled in 640]"
"635","42.319909800","10.85.52.122","10.85.52.177","TCP","54","3000  >  60304 [ACK] Seq=5017 Ack=48586 Win=65392 Len=0"
"636","42.328370900","10.85.52.177","10.85.52.122","TCP","240","60304  >  3000 [PSH, ACK] Seq=48586 Ack=5017 Win=1416 Len=186 [TCP PDU reassembled in 640]"
"637","42.330404000","10.85.52.177","10.85.52.122","TCP","590","60304  >  3000 [ACK] Seq=48772 Ack=5017 Win=1416 Len=536 [TCP PDU reassembled in 640]"
"638","42.330404000","10.85.52.177","10.85.52.122","TCP","404","60304  >  3000 [PSH, ACK] Seq=49308 Ack=5017 Win=1416 Len=350 [TCP PDU reassembled in 640]"
"639","42.330678600","10.85.52.122","10.85.52.177","TCP","54","3000  >  60304 [ACK] Seq=5017 Ack=49308 Win=65392 Len=0"
"640","42.346547100","10.85.52.177","10.85.52.122","HTTP","171","POST /api/data/large HTTP/1.1 "
"641","42.346547100","10.85.52.177","10.85.52.122","TCP","54","[TCP Window Update] 60304  >  3000 [ACK] Seq=49775 Ack=5017 Win=1952 Len=0"
"642","42.346547100","10.85.52.177","10.85.52.122","TCP","240","60304  >  3000 [PSH, ACK] Seq=49775 Ack=5017 Win=1952 Len=186 [TCP PDU reassembled in 652]"
"643","42.346820400","10.85.52.122","10.85.52.177","TCP","54","3000  >  60304 [ACK] Seq=5017 Ack=49775 Win=64925 Len=0"
"644","42.347807500","10.85.52.122","10.85.52.177","HTTP","282","HTTP/1.1 200 OK  (text/html)"
"645","42.351797200","10.85.52.177","10.85.52.122","TCP","473","60304  >  3000 [PSH, ACK] Seq=49961 Ack=5017 Win=1952 Len=419 [TCP PDU reassembled in 652]"
"646","42.358396900","10.85.52.177","10.85.52.122","TCP","521","60304  >  3000 [PSH, ACK] Seq=50380 Ack=5017 Win=1952 Len=467 [TCP PDU reassembled in 652]"
"647","42.358642000","10.85.52.122","10.85.52.177","TCP","54","3000  >  60304 [ACK] Seq=5245 Ack=50847 Win=65392 Len=0"
"648","42.360463200","10.85.52.177","10.85.52.122","TCP","240","60304  >  3000 [PSH, ACK] Seq=50847 Ack=5245 Win=1724 Len=186 [TCP PDU reassembled in 652]"
"649","42.368132400","10.85.52.177","10.85.52.122","TCP","590","60304  >  3000 [ACK] Seq=51033 Ack=5245 Win=1724 Len=536 [TCP PDU reassembled in 652]"
"650","42.368132400","10.85.52.177","10.85.52.122","TCP","404","60304  >  3000 [PSH, ACK] Seq=51569 Ack=5245 Win=1724 Len=350 [TCP PDU reassembled in 652]"
"651","42.368429300","10.85.52.122","10.85.52.177","TCP","54","3000  >  60304 [ACK] Seq=5245 Ack=51569 Win=65392 Len=0"
"652","42.381463300","10.85.52.177","10.85.52.122","HTTP","171","POST /api/data/large HTTP/1.1 "
"653","42.381463300","10.85.52.177","10.85.52.122","TCP","240","60304  >  3000 [PSH, ACK] Seq=52036 Ack=5245 Win=1724 Len=186 [TCP PDU reassembled in 663]"
"654","42.381837800","10.85.52.122","10.85.52.177","TCP","54","3000  >  60304 [ACK] Seq=5245 Ack=52036 Win=64925 Len=0"
"655","42.382743700","10.85.52.122","10.85.52.177","HTTP","282","HTTP/1.1 200 OK  (text/html)"
"656","42.383002000","10.85.52.177","10.85.52.122","TCP","473","60304  >  3000 [PSH, ACK] Seq=52222 Ack=5245 Win=1724 Len=419 [TCP PDU reassembled in 663]"
"657","42.391556100","10.85.52.177","10.85.52.122","TCP","590","60304  >  3000 [ACK] Seq=52641 Ack=5473 Win=1496 Len=536 [TCP PDU reassembled in 663]"
"658","42.391851600","10.85.52.122","10.85.52.177","TCP","54","3000  >  60304 [ACK] Seq=5473 Ack=53177 Win=65392 Len=0"
"659","42.393544700","10.85.52.177","10.85.52.122","TCP","171","60304  >  3000 [PSH, ACK] Seq=53177 Ack=5473 Win=1496 Len=117 [TCP PDU reassembled in 663]"
"660","42.405198400","10.85.52.177","10.85.52.122","TCP","590","60304  >  3000 [ACK] Seq=53294 Ack=5473 Win=1496 Len=536 [TCP PDU reassembled in 663]"
"661","42.405369900","10.85.52.122","10.85.52.177","TCP","54","3000  >  60304 [ACK] Seq=5473 Ack=53830 Win=65392 Len=0"
"662","42.408781100","10.85.52.177","10.85.52.122","TCP","473","60304  >  3000 [PSH, ACK] Seq=53830 Ack=5473 Win=1496 Len=419 [TCP PDU reassembled in 663]"
"663","42.420743200","10.85.52.177","10.85.52.122","HTTP","102","POST /api/data/large HTTP/1.1 "
"664","42.420743200","10.85.52.177","10.85.52.122","TCP","54","[TCP Window Update] 60304  >  3000 [ACK] Seq=54297 Ack=5473 Win=2032 Len=0"
"665","42.420902400","10.85.52.122","10.85.52.177","TCP","54","3000  >  60304 [ACK] Seq=5473 Ack=54297 Win=64925 Len=0"
"666","42.423957900","10.85.52.177","10.85.52.122","TCP","240","60304  >  3000 [PSH, ACK] Seq=54297 Ack=5473 Win=2032 Len=186 [TCP PDU reassembled in 675]"
"667","42.423957900","10.85.52.177","10.85.52.122","TCP","473","60304  >  3000 [PSH, ACK] Seq=54483 Ack=5473 Win=2032 Len=419 [TCP PDU reassembled in 675]"
"668","42.424157600","10.85.52.122","10.85.52.177","TCP","54","3000  >  60304 [ACK] Seq=5473 Ack=54902 Win=65392 Len=0"
"669","42.424904400","10.85.52.122","10.85.52.177","HTTP","282","HTTP/1.1 200 OK  (text/html)"
"670","42.432499900","10.85.52.177","10.85.52.122","TCP","521","60304  >  3000 [PSH, ACK] Seq=54902 Ack=5473 Win=2032 Len=467 [TCP PDU reassembled in 675]"
"671","42.434790100","10.85.52.177","10.85.52.122","TCP","590","60304  >  3000 [ACK] Seq=55369 Ack=5701 Win=1804 Len=536 [TCP PDU reassembled in 675]"
"672","42.434790100","10.85.52.177","10.85.52.122","TCP","123","60304  >  3000 [PSH, ACK] Seq=55905 Ack=5701 Win=1804 Len=69 [TCP PDU reassembled in 675]"
"673","42.434935300","10.85.52.122","10.85.52.177","TCP","54","3000  >  60304 [ACK] Seq=5701 Ack=55905 Win=65392 Len=0"
